{"graph_schema_version":1,"graph_version":"gv1:78c61541c1f09cc7f3cc66e38ff84732bd54d73ee038924dc6517d885d933a16","nodes":[{"citations":[{"content_identity":null,"source_id":"source-primary","stance":"supports"}],"id":"agency-necessity-rule","kind":"decision-rule","label":"Agency necessity rule","lifecycle":"supported","source":null,"statement":"Agentic control survives only when runtime agency is evidenced."},{"citations":[{"content_identity":null,"source_id":"source-primary","stance":"supports"},{"content_identity":null,"source_id":"source-secondary","stance":"challenges"}],"id":"agency-needs-open-tool-choice","kind":"theory","label":"Agency needs open tool choice","lifecycle":"challenged","source":null,"statement":"Runtime agency is warranted when tool choice cannot be fixed in advance."},{"citations":[{"content_identity":null,"source_id":"source-primary","stance":"supports"}],"id":"agency-needs-unpredictable-steps","kind":"theory","label":"Agency needs unpredictable steps","lifecycle":"supported","source":null,"statement":"Runtime agency is warranted only when step order cannot be predefined."},{"citations":[{"content_identity":null,"source_id":"source-primary","stance":"supports"}],"id":"agentic-control","kind":"architecture-class","label":"Agentic control","lifecycle":"supported","source":null,"statement":"Execution steps and tool choice are decided at run time."},{"citations":[{"content_identity":null,"source_id":"source-secondary","stance":"challenges"}],"id":"fixed-workflow-sufficed","kind":"counterexample","label":"Fixed workflow sufficed","lifecycle":"supported","source":null,"statement":"A synthetic case where a fixed workflow covered every residual case."},{"citations":[{"content_identity":null,"source_id":"source-primary","stance":"supports"}],"id":"irreversible-action-veto","kind":"constraint","label":"Irreversible action veto","lifecycle":"supported","source":null,"statement":"An irreversible consequential action bars unsupervised runtime authority."},{"citations":[{"content_identity":null,"source_id":"source-primary","stance":"supports"}],"id":"residual-case-coverage","kind":"decision-criterion","label":"Residual case coverage","lifecycle":"supported","source":null,"statement":"A fixed workflow must be shown insufficient for the residual cases."},{"citations":[{"content_identity":null,"source_id":"source-primary","stance":"supports"}],"id":"runtime-agency","kind":"concept","label":"Runtime agency","lifecycle":"supported","source":null,"statement":"A model selects or revises execution steps at run time."},{"citations":[],"id":"source-primary","kind":"evidence-source","label":"Primary synthetic reference","lifecycle":"supported","source":{"date_kind":"published","dated":"2024-05-01","locator":"urn:example:synthetic-reference-1","publication_state":"published","version":"2nd edition"},"statement":"An independently authored synthetic reference on control-class trade-offs."},{"citations":[],"id":"source-secondary","kind":"evidence-source","label":"Secondary synthetic reference","lifecycle":"supported","source":{"date_kind":"retrieved","dated":"2025-01-09","locator":"urn:example:synthetic-reference-2","publication_state":"preprint","version":null},"statement":"An independently authored synthetic counter-reference."},{"citations":[{"content_identity":null,"source_id":"source-primary","stance":"supports"}],"id":"supervised-replanning","kind":"pattern","label":"Supervised replanning","lifecycle":"proposed","source":null,"statement":"A model replans while a human approves each consequential action."}],"relations":[{"citations":[{"content_identity":null,"source_id":"source-secondary","stance":"challenges"}],"id":"counterexample-challenges-theory","kind":"challenges","lifecycle":"supported","object_id":"agency-needs-open-tool-choice","statement":"The counterexample shows open tool choice alone did not require agency.","subject_id":"fixed-workflow-sufficed"},{"citations":[{"content_identity":null,"source_id":"source-primary","stance":"supports"}],"id":"criterion-applies-to-class","kind":"applies-to","lifecycle":"supported","object_id":"agentic-control","statement":"Residual case coverage is judged before agentic control survives.","subject_id":"residual-case-coverage"},{"citations":[{"content_identity":null,"source_id":"source-primary","stance":"supports"}],"id":"pattern-specialises-class","kind":"specialises","lifecycle":"supported","object_id":"agentic-control","statement":"Supervised replanning is a constrained form of agentic control.","subject_id":"supervised-replanning"},{"citations":[{"content_identity":null,"source_id":"source-primary","stance":"supports"}],"id":"theory-informs-rule","kind":"informs-rule","lifecycle":"supported","object_id":"agency-necessity-rule","statement":"The theory is the rationale the rule encodes.","subject_id":"agency-needs-unpredictable-steps"},{"citations":[{"content_identity":null,"source_id":"source-primary","stance":"supports"}],"id":"theory-supersedes-theory","kind":"supersedes","lifecycle":"proposed","object_id":"agency-needs-open-tool-choice","statement":"The step-order theory supersedes the tool-choice theory by reference.","subject_id":"agency-needs-unpredictable-steps"},{"citations":[{"content_identity":null,"source_id":"source-primary","stance":"supports"}],"id":"theory-supports-criterion","kind":"supports","lifecycle":"supported","object_id":"residual-case-coverage","statement":"The theory motivates judging residual coverage first.","subject_id":"agency-needs-unpredictable-steps"},{"citations":[{"content_identity":null,"source_id":"source-primary","stance":"supports"}],"id":"veto-constrains-class","kind":"constrains","lifecycle":"supported","object_id":"agentic-control","statement":"The veto bars agentic control over irreversible actions.","subject_id":"irreversible-action-veto"}],"snapshot_content_identity":"sha256:1c0afd2dce0ab61478e760fa0e4b8b48af50d8314154c18976bf355064180124"}
